{
  "$schema": "http://json-schema.org/draft-07/schema#",
  "title": "Project Translator Configuration",
  "description": "Schema for project.translation.json",
  "type": "object",
  "required": [
    "currentVendor",
    "vendors"
  ],
  "properties": {
    "$schema": {
      "type": "string",
      "minLength": 1
    },
    "currentVendor": {
      "type": "string",
      "minLength": 1
    },
    "vendors": {
      "type": "array",
      "minItems": 1,
      "items": {
        "type": "object",
        "required": [
          "name",
          "apiEndpoint",
          "model"
        ],
        "properties": {
          "name": {
            "type": "string",
            "minLength": 1
          },
          "apiEndpoint": {
            "type": "string",
            "minLength": 1
          },
          "apiKey": {
            "type": "string"
          },
          "apiKeyEnvVarName": {
            "type": "string"
          },
          "model": {
            "type": "string",
            "minLength": 1
          },
          "rpm": {
            "type": "number",
            "minimum": 0
          },
          "maxTokensPerSegment": {
            "type": "number",
            "minimum": 1
          },
          "timeout": {
            "type": "number",
            "minimum": 1
          },
          "temperature": {
            "type": "number",
            "minimum": 0,
            "maximum": 2
          },
          "top_p": {
            "type": "number",
            "minimum": 0,
            "maximum": 1
          },
          "streamMode": {
            "type": "boolean"
          }
        },
        "additionalProperties": false
      }
    },
    "systemPromptLanguage": {
      "type": "string",
      "minLength": 1
    },
    "debug": {
      "type": "boolean"
    },
    "enableMetrics": {
      "type": "boolean"
    },
    "logFile": {
      "type": "object",
      "properties": {
        "enabled": {
          "type": "boolean"
        },
        "path": {
          "type": "string"
        },
        "maxSizeKB": {
          "type": "number",
          "minimum": 1024,
          "maximum": 102400
        },
        "maxFiles": {
          "type": "number",
          "minimum": 1,
          "maximum": 20
        }
      },
      "additionalProperties": false
    },
    "specifiedFiles": {
      "type": "array",
      "items": {
        "type": "object",
        "required": [
          "sourceFile",
          "targetFiles"
        ],
        "properties": {
          "sourceFile": {
            "type": "object",
            "required": [
              "path",
              "lang"
            ],
            "properties": {
              "path": {
                "type": "string",
                "minLength": 1
              },
              "lang": {
                "type": "string",
                "minLength": 1,
                "maxLength": 9
              }
            },
            "additionalProperties": false
          },
          "targetFiles": {
            "type": "array",
            "items": {
              "type": "object",
              "required": [
                "path",
                "lang"
              ],
              "properties": {
                "path": {
                  "type": "string",
                  "minLength": 1
                },
                "lang": {
                  "type": "string",
                  "minLength": 1,
                  "maxLength": 9
                }
              },
              "additionalProperties": false
            }
          }
        },
        "additionalProperties": false
      }
    },
    "specifiedFolders": {
      "type": "array",
      "items": {
        "type": "object",
        "required": [
          "sourceFolder",
          "targetFolders"
        ],
        "properties": {
          "sourceFolder": {
            "type": "object",
            "required": [
              "path",
              "lang"
            ],
            "properties": {
              "path": {
                "type": "string",
                "minLength": 1
              },
              "lang": {
                "type": "string",
                "minLength": 1,
                "maxLength": 9
              }
            },
            "additionalProperties": false
          },
          "targetFolders": {
            "type": "array",
            "items": {
              "type": "object",
              "required": [
                "path",
                "lang"
              ],
              "properties": {
                "path": {
                  "type": "string",
                  "minLength": 1
                },
                "lang": {
                  "type": "string",
                  "minLength": 1,
                  "maxLength": 9
                }
              },
              "additionalProperties": false
            }
          }
        },
        "additionalProperties": false
      }
    },
    "translationIntervalDays": {
      "type": "number",
      "minimum": -1
    },
    "copyOnly": {
      "type": "object",
      "properties": {
        "paths": {
          "type": "array",
          "items": {
            "type": "string"
          }
        },
        "extensions": {
          "type": "array",
          "items": {
            "type": "string"
          }
        }
      },
      "additionalProperties": false
    },
    "ignore": {
      "type": "object",
      "properties": {
        "paths": {
          "type": "array",
          "items": {
            "type": "string"
          }
        },
        "extensions": {
          "type": "array",
          "items": {
            "type": "string"
          }
        }
      },
      "additionalProperties": false
    },
    "customPrompts": {
      "type": "array",
      "items": {
        "type": "string"
      }
    },
    "segmentationMarkers": {
      "type": "object",
      "additionalProperties": {
        "type": "array",
        "items": {
          "type": "string"
        }
      }
    },
    "diffApply": {
      "type": "object",
      "properties": {
        "enabled": {
          "type": "boolean"
        },
        "validationLevel": {
          "type": "string",
          "enum": [
            "normal",
            "strict"
          ]
        },
        "autoBackup": {
          "type": "boolean"
        },
        "maxOperationsPerFile": {
          "type": "number",
          "minimum": 1,
          "maximum": 10000
        }
      },
      "additionalProperties": false
    },
    "skipFrontMatterMarkers": {
      "type": "object",
      "properties": {
        "enabled": {
          "type": "boolean"
        },
        "markers": {
          "type": "array",
          "items": {
            "type": "object",
            "required": [
              "key",
              "value"
            ],
            "properties": {
              "key": {
                "type": "string",
                "minLength": 1
              },
              "value": {
                "type": "string"
              }
            },
            "additionalProperties": false
          }
        }
      },
      "additionalProperties": false
    },
    "skipFrontMatter": {
      "type": "object",
      "properties": {
        "enabled": {
          "type": "boolean"
        },
        "markers": {
          "type": "array",
          "items": {
            "type": "object",
            "required": [
              "key",
              "value"
            ],
            "properties": {
              "key": {
                "type": "string",
                "minLength": 1
              },
              "value": {
                "type": "string"
              }
            },
            "additionalProperties": false
          }
        }
      },
      "additionalProperties": false
    },
    "systemPrompts": {
      "type": "array",
      "items": {
        "type": "string"
      }
    },
    "userPrompts": {
      "type": "array",
      "items": {
        "type": "string"
      }
    }
  },
  "additionalProperties": false
}
